denominacion,descripcion,actualizacion,fecha,jurisdiccion,nombre_tarjeta_home
Líneas de Alta Tensión,Traza de líneas de alta tensión,Eventual,2º semestre de 2016,Ministerio de Energía y Minería,Energía y Minería
Balance Energético Nacional ,"Oferta, transformación y demanda de energía eléctrica",Anual,2º semestre de 2016,Ministerio de Energía y Minería,Energía y Minería
Solicitudes de Acceso a la Información,Registro de solicitudes efectuadas en el marco de la normativa de acceso a la informacion,Semestral,2º semestre de 2016,"Ministerio del Interior, Obras Públicas y Vivienda",Interior
Audiencias de Gestión de Intereses,Registro de audiencias efectuadas en el marco del decreto 1172/2003,Eventual,2º semestre de 2016,"Ministerio del Interior, Obras Públicas y Vivienda",Interior
Base de datos Hidrologica Integrada,"Base de datos diferenciado por red hidrologica, cuenca, rio, parametros y/o Provincia",Semestral,2º semestre de 2016,"Ministerio del Interior, Obras Públicas y Vivienda",Interior
Datos de Municipios,"Información sobre autoridades, ubicacion geografica, datos institucionales y contacto",Eventual,1º semestre de 2017,"Ministerio del Interior, Obras Públicas y Vivienda",Interior
Datos e información Electoral,"Resultados historicos de Elecciones Nacionales: Cantidad de electores, votos válidos, en blanco y nulos de todos los distritos.",Anual,2º semestre de 2016,"Ministerio del Interior, Obras Públicas y Vivienda",Interior
Sistema de Información Geográfica,Sistema de Información Geográfica desarrollado por la Subsecretaría de Planificación Territorial del Ministerio del Interior,Semestral,1º semestre de 2017,"Ministerio del Interior, Obras Públicas y Vivienda",Interior
Plan Estrategico Territorial,Descripción de los planes comprendidos en el PET,Eventual,1º semestre de 2017,"Ministerio del Interior, Obras Públicas y Vivienda",Interior
Atlas de indicadores de desarrollo territoriales,Visualización de fenómenos y procesos de desarrollo que caracterizan al territorio argentino,Eventual,1º semestre de 2017,"Ministerio del Interior, Obras Públicas y Vivienda",Interior
Sistema de Identificación y Ponderación de Proyectos Estrategicos,Datos sobre proyectos y planes del SIPPE,Eventual,1º semestre de 2017,"Ministerio del Interior, Obras Públicas y Vivienda",Interior
Estadisticas MIgratorias,Información sobre movimientos migratorios en el Pais,Semestral,1º semestre de 2017,"Ministerio del Interior, Obras Públicas y Vivienda",Interior
Mapa de Conectividad de Redes de la República Argentina,"Mapa de redes de telecomunicaciones mostrando la oferta de servicios fijos, moviles y de conectividad de banda ancha, Backbones de fibra optica y los puntos de interconexión en cada localidad o departamento del país. ",Trimestral,1º semestre de 2017,Ministerio de Comunicaciones,Comunicaciones
Registro de Proveedores Postales y Servicios de Mensajería,Listado de prestadores postales y servicios de mensajería autorizados a dar servicios postales en la Republica Argentina,Semanal,2º semestre de 2016,Ministerio de Comunicaciones,Comunicaciones
Listado de prestadores de telefonía,"Listado de prestadores de telefonía fija, móvil y de larga distancia autorizados a dar servicio",Semanal,2º semestre de 2016,Ministerio de Comunicaciones,Comunicaciones
Servicio Móvil Marítimo y Aeronáutico ,Listado de embarcaciones autorizadas,Semanal,2º semestre de 2016,Ministerio de Comunicaciones,Comunicaciones
Licencias de radiodifusión,Listado de licencias de radiodifusión,Semanal,2º semestre de 2016,Ministerio de Comunicaciones,Comunicaciones
Radioaficionados,Listado de radioaficionados autorizados,Semanal,2º semestre de 2016,Ministerio de Comunicaciones,Comunicaciones
Operadores de Telecomunicaciones,Listado de operadores certificados,Semanal,2º semestre de 2016,Ministerio de Comunicaciones,Comunicaciones
Equipos inscriptos homologadas,Homologación de equipos inscriptos,Semanal,2º semestre de 2016,Ministerio de Comunicaciones,Comunicaciones
Empresas inscriptas homologadas,Homologación de empresas inscriptas,Semanal,2º semestre de 2016,Ministerio de Comunicaciones,Comunicaciones
Servicios de Internet,Servicios de Internet,Semanal,1º semestre de 2017,Ministerio de Comunicaciones,Comunicaciones
Radioclubes,Listado de radioclubes,Semanal,1º semestre de 2017,Ministerio de Comunicaciones,Comunicaciones
Estaciones repetidoras,Listado de estaciones repetidoras,Semanal,1º semestre de 2017,Ministerio de Comunicaciones,Comunicaciones
Señales distintivas,Listado de señales distintivas,Semanal,1º semestre de 2017,Ministerio de Comunicaciones,Comunicaciones
Numeración geográfica y no geográficas,"Numeración asociada a una zona geográfica en particular, y aquellas cuyo destino puede estar en cualquier parte del territorio nacional",Mensual,1º semestre de 2017,Ministerio de Comunicaciones,Comunicaciones
Reclamos de Usuarios,"Información georeferenciada de los reclamos por usuarios, prestadoras y tipos de servicios",Mensual,2º semestre de 2017,Ministerio de Comunicaciones,Comunicaciones
"Radiaciones
No Ionizantes (RNI)","Información sobre las mediciones realizadas sobre radiaciones electromagnéticas de los diversos servicios y sistemas
de comunicaciones radioeléctricos.",Mensual,2º semestre de 2017,Ministerio de Comunicaciones,Comunicaciones
"Proyectos de ciencia, tecnología e innovación","Proyectos de ciencia, tecnología e innovación, incluyendo montos totales aprobados y financiados, fecha de inicio, provincia de ejecución,  región de ejecución, tipo de proyecto, gran área del conocimiento (para proyectos de I+D) y tipo de institución de ejecución.",Anual,2º semestre de 2016,Ministerio de Ciencia y Tecnología,Ciencia y Tecnología
"Empresas de ejecución de proyectos de ciencia, tecnología e innovación","Empresas de ejecución de proyectos de ciencia, tecnología e innovación, cantidad de proyectos, tipo de proyectos,  provincia argentina y fecha de inicio.",Anual,2º semestre de 2016,Ministerio de Ciencia y Tecnología,Ciencia y Tecnología
Equipamiento científico-tecnológico ,Equipamiento científico-tecnológico según tipo de institución y provincia de localización.,Anual,2º semestre de 2016,Ministerio de Ciencia y Tecnología,Ciencia y Tecnología
Instituciones del Sistema Nacional de Ciencia y Tecnología Argentino ,"Instituciones del Sistema Nacional de Ciencia y Tecnología Argentino según tipo de institución, provincia de localización, tipo de recursos humanos, máximo nivel educativo alcanzado, disciplina de experticia.",Anual,2º semestre de 2016,Ministerio de Ciencia y Tecnología,Ciencia y Tecnología
Recursos humanos en Ciencia y Tecnología,"Recursos humanos en Ciencia y Tecnología por provincia, máximo nivel educativo alcanzado, género, rangos de edad, tipo de personal de I+D y gran área del conocimiento de la formación de grado,  tipo de institución de trabajo,  categoría en CONICET y categoría en el Programa de Incentivos a los Docentes Investigadores.",Anual,2º semestre de 2016,Ministerio de Ciencia y Tecnología,Ciencia y Tecnología
Base de Instrumentos para el Desarrollo Productivo (BIDP),"Registo de subsidios e incentivos que brinda el Estado Nacional para fines productivos a través de sus organismos (excluye programas sociales). Incluye un Padrón de Políticas, con la descripción de cada política de apoyo productivo, y un Padrón de Beneficiarios, con información de los beneficios percibidos por las empresas beneficiarias de los programas.",Mensual,2º semestre de 2016,Ministerio de Producción,Producción
Banco de Proyectos de Inversión Pública,"Registro de los proyectos de inversión de todos los organismos del Sector Publico Nacional. Creado por ley 24,354 del año 1994. Todos los organismos del SPN tienen obligación de registrar sus proyectos en este Banco, lo hacen en forma directa a través de un aplicativo que se conecta con el Servidor administrado por la Dirección Nacional de Inversión Pública,  y próximamente en un nuevo sistema informático en entorno Web. Los principales campos de cada proyecto se publican en Internet en la Web del Ministerio.",Diaria,2º semestre de 2016,Ministerio de Producción,Producción
Registro Industrial de la Nacion,El Registro Industrial de la Nación (RIN) tiene un rol fundamental en la recopilación de información cuantitativa y cualitativa sobre las industrias que desarrollan actividades en el Territorio Nacional.,Anual,1º semestre de 2017,Ministerio de Producción,Producción
Registro de Armas Quimicas,"El registro incluye las personas físicas y jurídicas que produzcan, comercialicen, importen o exporten sustancias químicas listadas por la Convención o sustancias químicas",Anual,1º semestre de 2017,Ministerio de Producción,Producción
Registro de Expertos Pymes ,"Base de datos en el marco del programa ""Expertos Pymes"" cuyo objetivo es brindar a las empresas la posibilidad de contratar expertos en asesoramiento técnico y organizacional.",Anual,1º semestre de 2017,Ministerio de Producción,Producción
Registro de Incubadoras ,"Registro de  personas jurídicas (mixtas, públicas o privadas) o entidades que ofrecen servicios de incubación de empresas.",Anual,1º semestre de 2017,Ministerio de Producción,Producción
Registro Pyme,"Registro de micro, pequeñas y medianas empresas",Eventual,1º semestre de 2017,Ministerio de Producción,Producción
Ciudades para Emprender,"Registro de Ciudades para Emprender, cuyo objetivo es impulsar la creación de nuevas empresas atendiendo a la vocación territorial y a la planificación económica estratégica y la generación de capacidades emprendedoras locales.",Anual,1º semestre de 2017,Ministerio de Producción,Producción
Registro de Aceleradoras,"Incluye información sobre aceleradoras que permitan el financiamiento y desarrollo de empresas innovadoras, de alto impacto y con mercados globales ",Anual,1º semestre de 2017,Ministerio de Producción,Producción
Registro del Programa Desarrollo de Proveedores ,Registro de Proveedores para sectores estrategicos,Anual,1º semestre de 2017,Ministerio de Producción,Producción
"Registro de fabricantes e importadores de vehículos, fabricantes e importadores de autopartes",Registro del sector automotriz ,Anual,1º semestre de 2017,Ministerio de Producción,Producción
"Fabricantes e importadores de bicicletas, registro de fabricantes e importadores de cámaras y cubiertas.",proveedores e importadores de bicicletas,Anual,1º semestre de 2017,Ministerio de Producción,Producción
Registro Nacional de laboratorios de ensayos de autopartes y vehículos completos.,Registro del sector automotriz ,Anual,1º semestre de 2017,Ministerio de Producción,Producción
Registro de Bienes de Capital,Registro de las empresas que fabrican bienes de capital ,Anual,1º semestre de 2017,Ministerio de Producción,Producción
Registro Nacional de Productores de Software y Servicios Informáticos.,"Registro correspondiente al Régimen de Promoción de la Industria del Software (Ley 25.922), que prevé beneficios para la industria del software y servicios informáticos.",Anual,1º semestre de 2017,Ministerio de Producción,Producción
Plan Nacional de Diseño ,"Registro abierto de agencias, diseñadores y empresas que participan del programa",Anual,1º semestre de 2017,Ministerio de Producción,Producción
COPREC,Registro de los reclamos del ciudadano en materia de defensa del consumidor como así también consultas respecto a los programas de precios de gobierno.,Anual,2º semestre de 2017,Ministerio de Producción,Producción
Tribunal arbitral,Registro de árbitros de consumidores y de cámaras empresariales.,Anual,2º semestre de 2017,Ministerio de Producción,Producción
Asociaciones de consumidores,Registro nacional de asociaciones de consumidores,Anual,2º semestre de 2017,Ministerio de Producción,Producción
Registro Nacional de Infractores,Registro según art. 49 del Anexo I al Decreto N 1798/94 reglamentario de la Ley 24.240,Anual,2º semestre de 2017,Ministerio de Producción,Producción
Metrología,Registro de operadores en materia de metrología legal.,Anual,2º semestre de 2017,Ministerio de Producción,Producción
Informes estadísticos y Protocolos.,Confección de estadísticas en base a la información recolectada por distintas fuentes como así también confección de protocolos para su posterior utilización por las fuerzas.,Eventual,2º semestre de 2016,Ministerio de Seguridad,Seguridad
DNFyC (Marte)/BECAS,"Contempla normativa de todos los programas de becas, los registros de todos los becarios, rendición de cuenta de las universidades, notas firmadas por el Director Nacional",Eventual,2º semestre de 2016,Ministerio de Seguridad,Seguridad
Sistema Nacional de Información Criminal (Total de hechos delictuosos y SAT Propiedad),Información a nivel nacional y provincial sobre presuntos hechos delictuosos registrados en sede policial (mesodatos).,Eventual,2º semestre de 2016,Ministerio de Seguridad,Seguridad
"Sistema Nacional de Información Criminal (Sistema de Alerta Temprana -SAT- de homicidios dolosos consumados y en grado de tentativa, homicidios culposos en accidentes de tránsito consumados y suicidios consumados).",Información a nivel nacional y provincial sobre presuntos hechos delictuosos registrados en sede policial (microdatos).,Eventual,2º semestre de 2016,Ministerio de Seguridad,Seguridad
"Carpeta documentos de trabajo y reportes estadísticos sobre delitos, hechos en dependencias policiales y recursos de las fuerzas","Información sobre cantidad de personal , equipamiento y operatividad de las 24 policias provinciales. Informes sobre delitos. Informes sobre detenidos.",Eventual,2º semestre de 2016,Ministerio de Seguridad,Seguridad
Observatorio Legislativo de Seguridad Ciudadana,Página web que tiene como objetivo erigirse como una herramienta de consulta para todos aquellos interesados en la normativa vinculada a la seguridad.,Eventual,2º semestre de 2016,Ministerio de Seguridad,Seguridad
Sistema Nacional de Información Criminial (SNIC),Estadísticas correspondientes al Sistema Nacional de Información Criminal.,Eventual,2º semestre de 2016,Ministerio de Seguridad,Seguridad
Prónostico del Tiempo,"Pronóstico de temperatura, viento y precipitación para varias localidades del país.",Diaria,1º semestre de 2017,Ministerio de Defensa,Defensa
GTS,Sistema coordinado de telecomunicación global que permite conocer los datos de las estaciones meteorológicas de todo el país.,Diaria,1º semestre de 2017,Ministerio de Defensa,Defensa
Registro de Temperatura,Temperaturas máximas y mínimas diarias registradas durante el último año.,Anual,1º semestre de 2017,Ministerio de Defensa,Defensa
Mapa de Estaciones,"Ubicación de las estaciones meteorológicas, su código OACI, latitud y longitud",Eventual,1º semestre de 2017,Ministerio de Defensa,Defensa
Datos de Radiación ,Datos que se obtienen mediante la medición de la radiación solar y su interacción con la atmósfera,Eventual,2º semestre de 2016,Ministerio de Defensa,Defensa
Alertas,Advertencias sobre fenómenos meteorológicos significativos que pueden poner en riesgo la vida de la población.,Eventual,2º semestre de 2016,Ministerio de Defensa,Defensa
Estado del Tiempo,Último registro de las variable meterológicas medidas en la red del SMN,Eventual,2º semestre de 2016,Ministerio de Defensa,Defensa
Imágenes Satelitales,Imagenes obtenidas a través de satelites geoestacionarios y satelites de órbita polar. ,Eventual,2º semestre de 2016,Ministerio de Defensa,Defensa
Imágenes de Radar,imágenes provenientes de los radares situados en diferentes provincias.,Eventual,2º semestre de 2016,Ministerio de Defensa,Defensa
Perspectiva Semanal,Pronóstico Extendido de fenómenos meteorológicos de alto impacto agrupados por semana e informados hasta con dos semanas de anticipación.,Eventual,2º semestre de 2016,Ministerio de Defensa,Defensa
Boletín de Tendencia Climática,Tendencia de temperatura y precipitación para los últimos tres meses presentada en base a un valor de referencia.,Mensual,2º semestre de 2016,Ministerio de Defensa,Defensa
Estadística Climática Básica,"Valores medios y/o extremos a nivel mensual y anual de algúnos parámetros (temperatura máxima, media y mínima, humedad, presión al nivel del mar, heliofanía, viento, precipitación, número de días con cielo cubierto, con cielo claro y con lluvia) calculados a partir de series históricas de los períodos 2001-2010.",Eventual,2º semestre de 2016,Ministerio de Defensa,Defensa
Informes Especiales,Reportes explicativos de situaciones anómalas y/o asociadas con fenómenos severos con posibles impactos sobre la sociedad y las actividades productivas.,Eventual,2º semestre de 2016,Ministerio de Defensa,Defensa
Caracterización Climática ,"Complementa las estadísticas climáticas básicas para cada estación de la red del SMN: olas de calor y de frio como así también de períodos con temperaturas mínimas/máximas muy altas; atlas climático 1961-1990 y 1981-2010 (mapas de los valores medios de temperatura media, máxima y mínima y de precipitación para los períodos indicados); mapas de tendencias de precipitación y de temperatura media; evolución de la temperatura media y de la precipitación a nivel país desde 1961.",Eventual,2º semestre de 2016,Ministerio de Defensa,Defensa
Vigilancia del clima,"Mapas y gráficos integrados en distintas escalas temporales de temperatura media, máxima y mínima y frecuencia de temperaturas extremas, precipitación días con precipitación, índices de sequías, heliofanía, y anomalías de dichos parámetros. Informes especiales sobre eventos climáticos destacados y boletines que describen el comportamiento mensual de las principales variables climáticas",Eventual,2º semestre de 2016,Ministerio de Defensa,Defensa
Boletín de estadísticas sobre Negociación Colectiva y Conflictividad Laboral,"Conjunto de indicadores que reflejan la situación y la evolución de la negociación colectiva y la conflictividad laboral.
En la sección de negociación colectiva, se incluyen las siguientes temáticas: cantidad mensual de convenios y acuerdos homologados,  trabajadores comprendidos, salarios básicos y conformados.
En referencia a conflictividad laboral, las temáticas más relevantes son: conflictos con paro y trabajadores involucrados en conflictos con paro.",Mensual,2º semestre de 2016,"Ministerio de Trabajo, Empleo, y Seguridad Social",Trabajo
Boletín de estadísticas sobre demografía de empresas y empleo,"Contiene información sobre la demografía de las empresas (aperturas, cierres, continuadoras) y la dinámica del empleo, sobre empresas de rápido crecimiento y supervivencia de las firmas. La información se presenta con desagregación sectorial y por tamaño de las firmas.",Trimestral,2º semestre de 2016,"Ministerio de Trabajo, Empleo, y Seguridad Social",Trabajo
Datos sobre el total de trabajadores registrados,"Describe la situación y evolución del total de trabajadores registrados (asalariados, trabajadores en casas particulares, autónomos y monotributistas)",Mensual,2º semestre de 2016,"Ministerio de Trabajo, Empleo, y Seguridad Social",Trabajo
Principales Prestaciones otorgadas por ANSES (en todos los casos se publican con opción a consulta por provincia y partido),Cantidad de Jubilaciones y Pensiones del Sistema Integrado Previsional Argentino (SIPA) otorgadas. ,Mensual,2º semestre de 2016,"Ministerio de Trabajo, Empleo, y Seguridad Social",Trabajo
Estadísticas Vitales (Serie 5 - DEIS),"Información sobre nacidos vivos, matrimonios, defunciones y defunciones fetales para el total del país y por jurisdicción, incluyendo
tasas y distribuciones relativas. ",Anual,2º semestre de 2016,Ministerio de Salud,Salud
Estadísticas de Consultas e Internación en Establecimientos Públicos (Serie 11 - DEIS),Egresos y consultas hospitalarias registradas en el Informe Estadístico de Internación en Establecimientos Públicos,Anual,1º semestre de 2017,Ministerio de Salud,Salud
Registro Federal de Establecimientos de Salud (REFES),"Registro de establecimientos sanitarios del país del sector público y privado, con y sin internación, que se encuentran funcionando en cada una de las jurisdicciones provinciales según la reglamentación vigente en ellas.",Eventual,2º semestre de 2016,Ministerio de Salud,Salud
Registro Federal de Profesionales de Salud (REFEPS),Registro oficial de Profesionales de Salud de todo el país de todas las profesiones matriculadas para el ejercicio profesional en salud,Eventual,2º semestre de 2016,Ministerio de Salud,Salud
Registro Nacional de Investigaciones en Salud (RENIS),Registro oficial y federal de investigaciones en Salud,Eventual,2º semestre de 2016,Ministerio de Salud,Salud
Registro Federal Farmacias (REFAR) y Registro Federal de Droguerías (REDRO),"Registro oficial de farmacias de atención al público, hospitalarias y droguerías de todo el país registrado por la autoridad jurisdiccional",Eventual,2º semestre de 2016,Ministerio de Salud,Salud
Legislacion en Salud de la República Argentina (LEGISALUD),"Registro de la legislación sanitaria intenacional,nacional, provincial y municipal vinculadas a todas las temáticas sanitarias agrupadas por tipo de legilsación, jurisdicción y por temática a texto completo",Eventual,2º semestre de 2016,Ministerio de Salud,Salud
Estadísticas CUS MEDICAMENTOS,"Serie histórica (sin nominalizar) de personas que recibieron medicamentos bajo prescripción del programa CUS MEDICAMENTOS por edad, sexo y provincia",Mensual,2º semestre de 2016,Ministerio de Salud,Salud
Recetas CUS  MEDICAMENTOS,Serie histórica de medicamentos recetados a través del programa CUS MEDICAMENTOS por provincia,Mensual,2º semestre de 2016,Ministerio de Salud,Salud
Consultas CUS MEDICAMENTOS,Serie histórica de consultas con médicos u odontólogos en CAPs que reciben botiquines CUS MEDICAMENTOS,Mensual,2º semestre de 2016,Ministerio de Salud,Salud
Estadísticas Inlcuir Salud,"Distribución por provincia y por ley de otorgamiento de beneficiarios, prestaciones otorgadas, monto de transferencias",Anual,2º semestre de 2016,Ministerio de Salud,Salud
Estadísticas Nacionales de VIH/Sida,"Estadísticas que surgen de las notificaciones nacionales de infecciones por VIH/Sida desglosadas por provincias. Incluye indicadores de gestión en prevención, diagnóstico y tratamiento ",Anual,2º semestre de 2016,Ministerio de Salud,Salud
Estadísticas SUMAR,"Estadísticas básicas de distribución de beneficiarios, transferencias y prestaciones",Trimestral,2º semestre de 2016,Ministerio de Salud,Salud
Estadísticas hospitalarias de establecimientos dependientes de Nación,"Cantidad de consultas, egresos, cirugías y camas disponibles en establecimientos nacionales. Diagnóstico por imágenes, cirugías por tipo y otras perstaciones.",Anual,1º semestre de 2017,Ministerio de Salud,Salud
Registro de personas con CUD (certificado único de desicapacidad),"Distribución por provincia, tipo de discapacidad, etc",Anual,2º semestre de 2016,Ministerio de Salud,Salud
Registro prestadores servicios de discapacidad,"Regitro de prestadores de servicios de discapacidad inscriptos en SNR (por provincia, tipo de prestación)",Eventual,2º semestre de 2016,Ministerio de Salud,Salud
Registros INCUCAI,"Pacientes en lista de espera para órganos y tejidos, expresiones de voluntad para la donación, pacientes con ERC",Eventual,2º semestre de 2016,Ministerio de Salud,Salud
Padrón de OOSS Nacionales,"Registro de OOSS, número de afiliados",Mensual,1º semestre de 2017,Ministerio de Salud,Salud
Financiamiento de OOSS,Monto de Subsidios otorgados por la Superintendencia de Servicios de Salud a OOSS Nacionales,Trimestral,2º semestre de 2016,Ministerio de Salud,Salud
Facturación Hospitales de Autogestión,Facturación y pagos recibidos de Hospitales de Autogestión por prestaciones a afiliados de OOSS,Mensual,1º semestre de 2017,Ministerio de Salud,Salud
ANMAT - Vademecun Nacional de Medicamentos,"Medicamentos comercializados en la República Argentina. La base incluye laboratorio, presentación, precio sugerido de venta al público",Eventual,2º semestre de 2016,Ministerio de Salud,Salud
ANMAT - Sistema Nacional de Farmacovigilancia,Notificaciones de reacciones adversas a medicamentos,Eventual,2º semestre de 2016,Ministerio de Salud,Salud
ANMAT- Registro Nacional de Establecimientos,Establecimientos certificados por autoridades sanitarias jurisdiccionales. Empresas elaboradoras de productos alimenticios o suplementos dietarios.,Eventual,2º semestre de 2016,Ministerio de Salud,Salud
ANMAT -Sistema de Información Federal para la Gestión del Control de los Alimentos,Consulta de productos inscriptos en el Registro Nacional de Productos Alimenticios. Autorizado por INAL.,Eventual,2º semestre de 2016,Ministerio de Salud,Salud
ANMAT- Cosméticos,"Listado y localización de productos elaboradores, imporatdores y exportadores de productos cosméticos",Eventual,2º semestre de 2016,Ministerio de Salud,Salud
ANMAT - Productos Domisanitarios,"Productos destinados a la limpieza, lavado, odorización, higienización del hogar certificados por ANMAT",Eventual,2º semestre de 2016,Ministerio de Salud,Salud
SIFER (Sistema Ferroviario Integrado),Subsidios otorgados al transporte ferroviario.,Trimestral,2º semestre de 2016,Ministerio de Transporte,Transporte
SISTAU (Sistema Integrado de Transporte Automotor),"Subsidios otorgados al transporte automotor, por provincia, municipio, línea, CUIT y razón social ",Trimestral,2º semestre de 2016,Ministerio de Transporte,Transporte
