denominacion,compromiso_id,descripcion,actualizacion_id,actualizacion,fecha,jurisdiccion_id,jurisdiccion,nombre_tarjeta_home
Prestacion por desempleo,352,Datos relativos al alcance de la prestación por desempleo,R/P3M,Trimestral,1º semestre de 2017,75,Trabajo,Trabajo
Otras Asignaciones familiares,353,Información relativa a las asignaciones de sujetos contributivos y sujetos no contribuitivos,R/P6M,Semestral,1º semestre de 2017,75,Trabajo,Trabajo
Estadísticas Vitales (Serie 5 - DEIS),354,"Información sobre nacidos vivos, matrimonios, defunciones y defunciones fetales para el total del país y por jurisdicción, incluyendotasas y distribuciones relativas.",R/P1Y,Anual,1º semestre de 2017,80,Salud,Salud
Estadísticas de Consultas e Internación en Establecimientos Públicos (Serie 11 - DEIS),355,Egresos y consultas hospitalarias registradas en el Informe Estadístico de Internación en Establecimientos Públicos,R/P1Y,Anual,1º semestre de 2017,80,Salud,Salud
Registro Federal de Establecimientos de Salud (REFES),356,"Registro de establecimientos sanitarios del país del sector público y privado, con y sin internación, que se encuentran funcionando en cada una de las jurisdicciones provinciales según la reglamentación vigente en ellas.",eventual,Eventual,1º semestre de 2017,80,Salud,Salud
Registro Federal de Profesionales de Salud (REFEPS),357,Registro oficial de Profesionales de Salud de todo el país de todas las profesiones matriculadas para el ejercicio profesional en salud,eventual,Eventual,1º semestre de 2017,80,Salud,Salud
Registro Nacional de Investigaciones en Salud (RENIS),358,Registro oficial y federal de investigaciones en Salud,eventual,Eventual,1º semestre de 2017,80,Salud,Salud
Registro Federal Farmacias (REFAR) y Registro Federal de Droguerías (REDRO),359,"Registro oficial de farmacias de atención al público, hospitalarias y droguerías de todo el país registrado por la autoridad jurisdiccional",eventual,Eventual,1º semestre de 2017,80,Salud,Salud
Legislacion en Salud de la República Argentina (LEGISALUD),360,"Registro de la legislación sanitaria intenacional,nacional, provincial y municipal vinculadas a todas las temáticas sanitarias agrupadas por tipo de legilsación, jurisdicción y por temática a texto completo",eventual,Eventual,1º semestre de 2017,80,Salud,Salud
Estadísticas CUS MEDICAMENTOS,361,"Serie histórica (sin nominalizar) de personas que recibieron medicamentos bajo prescripción del programa CUS MEDICAMENTOS por edad, sexo y provincia",R/P1M,Mensual,1º semestre de 2017,80,Salud,Salud
Recetas CUS MEDICAMENTOS,362,Serie histórica de medicamentos recetados a través del programa CUS MEDICAMENTOS por provincia,R/P1M,Mensual,1º semestre de 2017,80,Salud,Salud
Consultas CUS MEDICAMENTOS,363,Serie histórica de consultas con médicos u odontólogos en CAPs que reciben botiquines CUS MEDICAMENTOS,R/P1M,Mensual,1º semestre de 2017,80,Salud,Salud
Estadísticas Inlcuir Salud,364,"Distribución por provincia y por ley de otorgamiento de beneficiarios, prestaciones otorgadas, monto de transferencias",R/P1Y,Anual,1º semestre de 2017,80,Salud,Salud
Estadísticas Nacionales de VIH/Sida,365,"Estadísticas que surgen de las notificaciones nacionales de infecciones por VIH/Sida desglosadas por provincias. Incluye indicadores de gestión en prevención, diagnóstico y tratamiento",R/P1Y,Anual,1º semestre de 2017,80,Salud,Salud
Estadísticas SUMAR,366,"Estadísticas de distribución de beneficiarios, transferencias y prestaciones",R/P3M,Trimestral,1º semestre de 2017,80,Salud,Salud
Boletín Integrado de Vigilancia,367,"Casos registrados de eventos bajo vigilancia (incluye Chagas, Dengue, Zika, infecciones respiratorias agudas)",R/P3M,Trimestral,1º semestre de 2017,80,Salud,Salud
Estadística Climática Básica,368,"Valores medios y/o extremos a nivel mensual y anual de algúnos parámetros (temperatura máxima, media y mínima, humedad, presión al nivel del mar, heliofanía, viento, precipitación, número de días con cielo cubierto, con cielo claro y con lluvia) calculados a partir de series históricas de los períodos 2001-2010.",R/P1Y,Anual,1º semestre de 2017,45,Defensa,Defensa
Vigilancia del clima,369,Mapas y gráficos integrados en distintas escalas temporales.,eventual,Eventual,1º semestre de 2017,45,Defensa,Defensa
Listado de Productos Comercializables,370,"Unidades de Negocios, Bienes y Servicios comercializados, especificaciones técnicas",R/P6M,Semestral,1º semestre de 2017,45,Defensa,Defensa
