denominacion,compromiso_id,descripcion,actualizacion_id,actualizacion,fecha,jurisdiccion_id,jurisdiccion,nombre_tarjeta_home
Base de Instrumentos para el Desarrollo Productivo (BIDP),226,"Registo de subsidios e incentivos que brinda el Estado Nacional para fines productivos a través de sus organismos (excluye programas sociales). Incluye un Padrón de Políticas, con la descripción de cada política de apoyo productivo, y un Padrón de Beneficiarios, con información de los beneficios percibidos por las empresas beneficiarias de los programas.",R/P1M,Mensual,2º semestre de 2016,51,Producción,Producción
Banco de Proyectos de Inversión Pública,227,"Registro de los proyectos de inversión de todos los organismos del Sector Publico Nacional. Creado por ley 24,354 del año 1994. Todos los organismos del SPN tienen obligación de registrar sus proyectos en este Banco, lo hacen en forma directa a través de un aplicativo que se conecta con el Servidor administrado por la Dirección Nacional de Inversión Pública, y próximamente en un nuevo sistema informático en entorno Web. Los principales campos de cada proyecto se publican en Internet en la Web del Ministerio.",R/P1D,Diaria,2º semestre de 2016,51,Producción,Producción
Registro Industrial de la Nacion,228,El Registro Industrial de la Nación (RIN) tiene un rol fundamental en la recopilación de información cuantitativa y cualitativa sobre las industrias que desarrollan actividades en el Territorio Nacional.,R/P1Y,Anual,1º semestre de 2017,51,Producción,Producción
Registro de Armas Quimicas,229,"El registro incluye las personas físicas y jurídicas que produzcan, comercialicen, importen o exporten sustancias químicas listadas por la Convención o sustancias químicas",R/P1Y,Anual,1º semestre de 2017,51,Producción,Producción
Registro de Expertos Pymes,230,"Base de datos en el marco del programa ""Expertos Pymes"" cuyo objetivo es brindar a las empresas la posibilidad de contratar expertos en asesoramiento técnico y organizacional.",R/P1Y,Anual,1º semestre de 2017,51,Producción,Producción
Registro de Incubadoras,231,"Registro de personas jurídicas (mixtas, públicas o privadas) o entidades que ofrecen servicios de incubación de empresas.",R/P1Y,Anual,1º semestre de 2017,51,Producción,Producción
Registro Pyme,232,"Registro de micro, pequeñas y medianas empresas",eventual,Eventual,1º semestre de 2017,51,Producción,Producción
Ciudades para Emprender,233,"Registro de Ciudades para Emprender, cuyo objetivo es impulsar la creación de nuevas empresas atendiendo a la vocación territorial y a la planificación económica estratégica y la generación de capacidades emprendedoras locales.",R/P1Y,Anual,1º semestre de 2017,51,Producción,Producción
Registro de Aceleradoras,234,"Incluye información sobre aceleradoras que permitan el financiamiento y desarrollo de empresas innovadoras, de alto impacto y con mercados globales",R/P1Y,Anual,1º semestre de 2017,51,Producción,Producción
Registro del Programa Desarrollo de Proveedores,235,Registro de Proveedores para sectores estrategicos,R/P1Y,Anual,1º semestre de 2017,51,Producción,Producción
"Registro de fabricantes e importadores de vehículos, fabricantes e importadores de autopartes",236,Registro del sector automotriz,R/P1Y,Anual,1º semestre de 2017,51,Producción,Producción
"Fabricantes e importadores de bicicletas, registro de fabricantes e importadores de cámaras y cubiertas.",237,proveedores e importadores de bicicletas,R/P1Y,Anual,1º semestre de 2017,51,Producción,Producción
Registro Nacional de laboratorios de ensayos de autopartes y vehículos completos.,238,Registro del sector automotriz,R/P1Y,Anual,1º semestre de 2017,51,Producción,Producción
Registro de Bienes de Capital,239,Registro de las empresas que fabrican bienes de capital,R/P1Y,Anual,2º semestre de 2017,51,Producción,Producción
Registro Nacional de Productores de Software y Servicios Informáticos.,240,"Registro correspondiente al Régimen de Promoción de la Industria del Software (Ley 25.922), que prevé beneficios para la industria del software y servicios informáticos.",R/P1Y,Anual,2º semestre de 2017,51,Producción,Producción
Plan Nacional de Diseño,241,"Registro abierto de agencias, diseñadores y empresas que participan del programa",R/P1Y,Anual,1º semestre de 2017,51,Producción,Producción
COPREC,242,Registro de los reclamos del ciudadano en materia de defensa del consumidor como así también consultas respecto a los programas de precios de gobierno.,R/P1Y,Anual,2º semestre de 2017,51,Producción,Producción
Tribunal arbitral,243,Registro de árbitros de consumidores y de cámaras empresariales.,R/P1Y,Anual,2º semestre de 2017,51,Producción,Producción
Asociaciones de consumidores,244,Registro nacional de asociaciones de consumidores,R/P1Y,Anual,2º semestre de 2017,51,Producción,Producción
Registro Nacional de Infractores,245,Registro según art. 49 del Anexo I al Decreto N 1798/94 reglamentario de la Ley 24.240,R/P1Y,Anual,2º semestre de 2017,51,Producción,Producción
Metrología,246,Registro de operadores en materia de metrología legal.,R/P1Y,Anual,2º semestre de 2017,51,Producción,Producción
Estadistica Educativa,247,"Desagregadas por modalidad, oferta educativa, nivel educativo y sector de gestion segun departamento",R/P6M,Semestral,1º semestre de 2017,70,Educación,Educación
Indicadores Educativos,248,"Información sobre Tasa de Promoción Efectiva, Tasa de Repitencia, Tasa de Abandono Interanual, Porcentaje de Sobreedad, Tasa de Escolarización",R/P6M,Semestral,1º semestre de 2017,70,Educación,Educación
Registro de Establecimientos Educativos,249,Padrón Oficial de Establecimientos Educativos,eventual,Eventual,1º semestre de 2017,70,Educación,Educación
Empresas de transporte RMBA,250,Detalle de empresas de transporte que operan: - Jurisdiccion Nacional - Jurisdicción Provincial - Jurisdicción Municipal,R/P3M,Trimestral,2º semestre de 2016,57,Transporte,Transporte
Líneas de transporte RMBA,251,Detalle de líneas de transporte que operan: - Jurisdiccion Nacional - Jurisdicción Provincial - Jurisdicción Municipal,R/P3M,Trimestral,2º semestre de 2016,57,Transporte,Transporte
Cancelaciones por año RMBA,252,Histórico de operaciones de viajes por año: A) Cantidad y detalle por modo. B) Cantidad y detalle por empresa. C) Cantidad y detalle de linea. D) Cantidad y detalle de linea y tipo de pasaje (normal - atributo social),R/P1Y,Anual,1º semestre de 2017,57,Transporte,Transporte
Cancelaciones mes RMBA,253,Histórico de operaciones de viajes por mes: A) Cantidad y detalle por modo. B) Cantidad y detalle por empresa. C) Cantidad y detalle de linea. D) Cantidad y detalle de linea y tipo de pasaje (normal - atributo social),R/P3M,Trimestral,2º semestre de 2016,57,Transporte,Transporte
Informes estadísticos y Protocolos.,254,Confección de estadísticas en base a la información recolectada por distintas fuentes como así también confección de protocolos para su posterior utilización por las fuerzas.,eventual,Eventual,1º semestre de 2017,41,Seguridad,Seguridad
DNFyC (Marte)/BECAS,255,"Contempla normativa de todos los programas de becas, los registros de todos los becarios, rendición de cuenta de las universidades, notas firmadas por el Director Nacional",eventual,Eventual,1º semestre de 2017,41,Seguridad,Seguridad
Sistema Nacional de Información Criminal (Total de hechos delictuosos y SAT Propiedad),256,Información a nivel nacional y provincial sobre presuntos hechos delictuosos registrados en sede policial (mesodatos).,R/P1Y,Anual,1º semestre de 2017,41,Seguridad,Seguridad
"Sistema Nacional de Información Criminal (Sistema de Alerta Temprana -SAT- de homicidios dolosos consumados y en grado de tentativa, homicidios culposos en accidentes de tránsito consumados y suicidios consumados).",257,Información a nivel nacional y provincial sobre presuntos hechos delictuosos registrados en sede policial (microdatos).,R/P1Y,Anual,1º semestre de 2017,41,Seguridad,Seguridad
Observatorio Legislativo de Seguridad Ciudadana,258,Página web que tiene como objetivo erigirse como una herramienta de consulta para todos aquellos interesados en la normativa vinculada a la seguridad.,eventual,Eventual,1º semestre de 2017,41,Seguridad,Seguridad
Asignación Salarial de las Autoridades Superiores del Poder Ejecutivo Nacional,259,Asignación salarial mensual (bruta)* de las Autoridades Superiores del Poder Ejecutivo Nacional.,R/P1M,Mensual,2º semestre de 2016,26,Modernización,Modernización
Estructura Orgánica y Autoridades del Poder Ejecutivo Nacional,260,"Estructura y autoridades de la Administración Centralizada del Estado Nacional, tomando como fuente de información el Boletín Oficial y los respectivos Decretos de designación de cargos en la Administración Pública Nacional.",eventual,Eventual,2º semestre de 2016,26,Modernización,Modernización
Sistema de Contrataciones Electrónicas,261,"Datos correspondiente al Sistema de Contrataciones Electrónicas, incluyendo las contrataciones de bienes y servicios, el Sistema de Información de Proveedores (SIPRO) y el Catálogo de Bienes y Servicios (SIByS)",eventual,Eventual,2º semestre de 2016,26,Modernización,Modernización
Registro Central de Personas Contratadas,262,"Nómina del personal contratado por el Poder Ejecutivo Nacional correspondiente a la Administración Central y Descentralizada, detallando información sobre el personal contratado, la modalidad del contrato, así como la jurisdicción y organismo contratante.",R/P3M,Trimestral,2º semestre de 2016,26,Modernización,Modernización
Catálogo de trámites y servicios,263,Inventario de trámites y servicios disponibles a través de Argentina.gob.ar,eventual,Eventual,2º semestre de 2016,26,Modernización,Modernización
Oferta del Sistema Nacional de Capacitación,264,"Cursos, becas, y actividades promovidas y organizadas por el Instituto Nacional de la Administración Pública (INAP) en el marco del Sistema Nacional de Capacitación.",eventual,Eventual,2º semestre de 2016,26,Modernización,Modernización
Registro de Prestadores del Sistema Nacional de Capacitación,265,Listado de prestadores inscriptos al Sistema Nacional de Capacitación,eventual,Eventual,2º semestre de 2016,26,Modernización,Modernización
Plan de Apertura de Datos,266,"Nómina de la totalidad de los Planes de Apertura de Datos de los Ministerios, Secretarías, y Organismos descentralizados y desconcentrados del Poder Ejecutivo Nacional, que han sido presentados como compromiso por parte de dichas jurisdicciones.",R/P1Y,Anual,2º semestre de 2016,26,Modernización,Modernización
Programa Nacional de Infraestructura Turística,267,Listado de obras turísticas realizadas en el marco del PNIT,eventual,Eventual,2º semestre de 2016,53,Turismo,Turismo
Consulta de Agencias de Viajes Autorizadas,268,"Listado de todas las Agencias de Turismo autorizadas en el país, incluyendo: Turismo Estudiantil, Turismo Receptivo y Turismo Receptivo Chino.",R/P1W,Semanal,1º semestre de 2017,53,Turismo,Turismo
Distinguidos de Calidad,269,Listado de Organizaciones distinguidas en Calidad de Turismo,eventual,Eventual,1º semestre de 2017,53,Turismo,Turismo
Llegadas de Turistas No residentes a la Argentina por todas las vías de ingresos,270,Listado por nacionalidad de Turistas no residentes que llegan a la Argentina.,R/P3M,Trimestral,1º semestre de 2017,53,Turismo,Turismo
Turistas residentes que viajan por Argentina,271,Listado de Turistas residentes que viajan por Argentina.,R/P3M,Trimestral,1º semestre de 2017,53,Turismo,Turismo
Registro Nacional de Prestadores,272,"Registro de Establecimientos y Padrón de Profesionales, ambos con fecha de vencimiento de inscripción",R/P1M,Mensual,1º semestre de 2017,80,Salud,Salud
Gestión de Reclamos,273,Estadísticas de Reclamos y Expedientes en trámite y resueltos. Incluye aquellos derivados de la Defensoría del Pueblo y Asociaciones.,R/P1M,Mensual,1º semestre de 2017,80,Salud,Salud
Compras y contrataciones,274,"Datos correspondientes a Contrataciones, Licitaciones públicas, empresas adjudicadas.",R/P1M,Mensual,1º semestre de 2017,80,Salud,Salud
Encuestas de Satisfacción,275,"Resultados de encuestas realizadas en los Centros de Atención de todo el país, y encuesta Online en WEB.",R/P6M,Semestral,1º semestre de 2017,80,Salud,Salud
Red de carga SUBE RMBA,276,"Puntos de venta de tarjetas SUBE: A) Detalle de puntos de venta, ubicación geográfica. B) Detalle de puntos de recarga, ubicación geográfica. C) Detalle de puntos de recarga automaticos (TAS), ubicación geográfica. D) Detalle de puntos de acreditacion de saldo (p/carga virtual), ubicación geográfica.",R/P3M,Trimestral,2º semestre de 2016,57,Transporte,Transporte
Trenes Transporte de pasajeros,277,Detalle pasajeros por línea / ramal,R/P1M,Mensual,1º semestre de 2017,57,Transporte,Transporte
Trenes Transporte de pasajeros,278,Detalle estaciones,eventual,Eventual,1º semestre de 2017,57,Transporte,Transporte
Puerto Buenos Aires,279,Cantidad de pasajeros (entrada - salida),R/P1M,Mensual,1º semestre de 2017,57,Transporte,Transporte
Aeropuertos,280,Detalle aeropuertos,eventual,Eventual,1º semestre de 2017,57,Transporte,Transporte
Aportes,281,Detalle de aportes al transporte público de pasajeros por medio: A) Colectivos (Corta y larga distancia) B) Trenes (Concesionados / Estado),R/P1M,Mensual,1º semestre de 2017,57,Transporte,Transporte
S.I.S.T.A.U. Sistema Integrado de Transporte Automotor,282,Subsidios Colectivos,R/P1M,Mensual,1º semestre de 2017,57,Transporte,Transporte
Servicio Móvil Marítimo y Aeronáutico,283,Listado de embarcaciones autorizadas,R/P1W,Semanal,2º semestre de 2016,59,Comunicaciones,Comunicaciones
Licencias de radiodifusión,284,Listado de licencias de radiodifusión,R/P1W,Semanal,2º semestre de 2016,59,Comunicaciones,Comunicaciones
Radioaficionados,285,Listado de radioaficionados autorizados,R/P1W,Semanal,2º semestre de 2016,59,Comunicaciones,Comunicaciones
Operadores de Telecomunicaciones,286,Listado de operadores certificados,R/P1W,Semanal,2º semestre de 2016,59,Comunicaciones,Comunicaciones
Equipos inscriptos homologadas,287,Homologación de equipos inscriptos,R/P1W,Semanal,2º semestre de 2016,59,Comunicaciones,Comunicaciones
Empresas inscriptas homologadas,288,Homologación de empresas inscriptas,R/P1W,Semanal,2º semestre de 2016,59,Comunicaciones,Comunicaciones
Servicios de Internet,289,Servicios de Internet,R/P1W,Semanal,1º semestre de 2017,59,Comunicaciones,Comunicaciones
Radioclubes,290,Listado de radioclubes,R/P1W,Semanal,1º semestre de 2017,59,Comunicaciones,Comunicaciones
Estaciones repetidoras,291,Listado de estaciones repetidoras,R/P1W,Semanal,1º semestre de 2017,59,Comunicaciones,Comunicaciones
Señales distintivas,292,Listado de señales distintivas,R/P1W,Semanal,1º semestre de 2017,59,Comunicaciones,Comunicaciones
Numeración geográfica y no geográficas,293,"Numeración asociada a una zona geográfica en particular, y aquellas cuyo destino puede estar en cualquier parte del territorio nacional",R/P1M,Mensual,1º semestre de 2017,59,Comunicaciones,Comunicaciones
Reclamos de Usuarios,294,"Información georeferenciada de los reclamos por usuarios, prestadoras y tipos de servicios",R/P1M,Mensual,2º semestre de 2017,59,Comunicaciones,Comunicaciones
Radiaciones No Ionizantes (RNI),295,Información sobre las mediciones realizadas sobre radiaciones electromagnéticas de los diversos servicios y sistemas de comunicaciones radioeléctricos.,R/P1M,Mensual,2º semestre de 2017,59,Comunicaciones,Comunicaciones
Solicitudes de Acceso a la Información,296,Registro de solicitudes efectuadas en el marco de la normativa de acceso a la informacion,R/P6M,Semestral,2º semestre de 2016,30,Interior,Interior
Audiencias de Gestión de Intereses,297,Registro de audiencias efectuadas en el marco del decreto 1172/2003,eventual,Eventual,2º semestre de 2016,30,Interior,Interior
Base de datos Hidrologica Integrada,298,"Base de datos diferenciado por red hidrologica, cuenca, rio, parametros y/o Provincia",R/P6M,Semestral,1º semestre de 2017,30,Interior,Interior
Datos de Municipios,299,"Información sobre autoridades, ubicacion geografica, datos institucionales y contacto",eventual,Eventual,1º semestre de 2017,30,Interior,Interior
Datos e información Electoral,300,"Resultados historicos de Elecciones Nacionales: Cantidad de electores, votos válidos, en blanco y nulos de todos los distritos.",R/P1Y,Anual,2º semestre de 2016,30,Interior,Interior
Sistema de Información Geográfica,301,Sistema de Información Geográfica desarrollado por la Subsecretaría de Planificación Territorial del Ministerio del Interior,R/P6M,Semestral,1º semestre de 2017,30,Interior,Interior
Plan Estrategico Territorial,302,Descripción de los planes comprendidos en el PET,eventual,Eventual,1º semestre de 2017,30,Interior,Interior
Atlas de indicadores de desarrollo territoriales,303,Visualización de fenómenos y procesos de desarrollo que caracterizan al territorio argentino,eventual,Eventual,1º semestre de 2017,30,Interior,Interior
Sistema de Identificación y Ponderación de Proyectos Estrategicos,304,Datos sobre proyectos y planes del SIPPE,eventual,Eventual,1º semestre de 2017,30,Interior,Interior
Estadisticas MIgratorias,305,Información sobre movimientos migratorios en el Pais,R/P6M,Semestral,1º semestre de 2017,30,Interior,Interior
Inventario de Archivos Abiertos de las FFAA,306,Documentos digitalizados vinculados a hallazgos que nos acercan al conocimiento de nuestra historia que se encuentran en los Archivos Generales de las FF.AA.,eventual,Eventual,2º semestre de 2016,45,Defensa,Defensa
Registro Público de Veteranos de Guerra de Malvinas,307,"Altas, Bajas y Modificaciones del Registro Público de Veteranos de Guerra de Malvinas.",R/P1M,Mensual,2º semestre de 2016,45,Defensa,Defensa
Operaciones de Paz,308,Información relativa a las misiones de Paz desplegadas por el Ministerio de Defensa.,R/P6M,Semestral,1º semestre de 2017,45,Defensa,Defensa
Agregadurias Militares,309,Información de los miembros destinados de las Agregadurías Militares.,R/P1Y,Anual,1º semestre de 2017,45,Defensa,Defensa
Formación,310,Estadístcas de los institutos de educación de todos los niveles que funcionan bajo la orbita de las FFAA.,R/P1Y,Anual,1º semestre de 2017,45,Defensa,Defensa
Apoyo a la Comunidad,311,Información de los apoyos a la comunidad brindados por las FFAA ante desastres naturales o sociales.,R/P6M,Semestral,1º semestre de 2017,45,Defensa,Defensa
Información con persepectiva de genero,312,Información sobre la integración de las mujeres a las FF.AA. Información institucional de las políticas de genero llevadas a cabo en el ambito del MINDEF.,R/P1Y,Anual,1º semestre de 2017,45,Defensa,Defensa
Cuestión Antartica,313,Información de las actividades antárticas del sistema de defensa.,R/P1Y,Anual,1º semestre de 2017,45,Defensa,Defensa
Ejercicios Combinados,314,Información de los Ejercicios combinados realizados con las FF.AA. de otros países.,R/P1Y,Anual,1º semestre de 2017,45,Defensa,Defensa
Listado de Productos Comercializables (Fabricaciones Militares),315,"Unidades de Negocios, Bienes y Servicios comercializados, especificaciones técnicas",R/P1M,Mensual,2º semestre de 2016,45,Defensa,Defensa
Fototeca departamento de Hidrografía,316,Catálogo de Fotografías,R/P1M,Mensual,1º semestre de 2017,45,Defensa,Defensa
Cartas electrónicas,317,Catálogo de Cartas Electrónicas,eventual,Eventual,1º semestre de 2017,45,Defensa,Defensa
Faros Argentinos,318,"Listad de Faros, nombre posición latitud-longitud",eventual,Eventual,1º semestre de 2017,45,Defensa,Defensa
Balizas,319,"Lista de las Balizas, Nombre Posición-Latitiud-Longitud",eventual,Eventual,1º semestre de 2017,45,Defensa,Defensa
Tablas de Marea,320,Planilla de predicciones de pleamares y bajamares,R/P1Y,Anual,1º semestre de 2017,45,Defensa,Defensa
Datos de Horarios de Marea,321,"Día, hora, estación, dato de marea",R/P1D,Diaria,1º semestre de 2017,45,Defensa,Defensa
Estaciones Meteorológicas,322,Planilla de ubicación de las estaciones mareográficas,R/P1Y,Anual,1º semestre de 2017,45,Defensa,Defensa
Tabla de Predicción de Corrientes,323,Planilla de predicciones de corrientes de Marea,R/P1Y,Anual,1º semestre de 2017,45,Defensa,Defensa
Pronósticos de Marea,324,Planilla de Pronóstico de Marea para el Río de la Plata,R/P1D,Diaria,1º semestre de 2017,45,Defensa,Defensa
Pronósticos de Olas,325,Planilla de Pronóstico de Olas para el Río de la Plata,R/P1D,Diaria,1º semestre de 2017,45,Defensa,Defensa
Informes de Campañas,326,"Listado de los informes de campañas. Nombre, actividades desarrolladas, zona de trabajo, fecha.",R/P6M,Semestral,1º semestre de 2017,45,Defensa,Defensa
Calidades de Fondo,327,Caracterizacion geologica del fondo marino según analisis de muestras obtenidas.,R/P6M,Semestral,1º semestre de 2017,45,Defensa,Defensa
Datos Fisico-químicos de agua de mar,328,"Tabla que contiene información periódica del agua de mar. Oxígeno disuelto, nutrientes, turbidez, nivel de clorofila, contaminantes, temperatura, corrientes, mareas, olas y datos meteorológicos",R/P6M,Semestral,1º semestre de 2017,45,Defensa,Defensa
Efemerides,329,Indica las horas de salida y puesta de sol y luna para cada dia del año y cada lugar.,R/P1D,Diaria,1º semestre de 2017,45,Defensa,Defensa
Convenios firmados por el IGN,330,Convenios firmados desde 1980,R/P1M,Mensual,2º semestre de 2016,45,Defensa,Defensa
Archivos de la Red Argentina de Monitoreo Satelital Permantente,331,Información disponible de todas las bases que integran el RAMSAC,R/PT1S,Tiempo real,2º semestre de 2016,45,Defensa,Defensa
Información del RAMSAC - NTRIP,332,Información sobre el posicionamiento en tiempo real,R/PT1S,Tiempo real,2º semestre de 2016,45,Defensa,Defensa
Mapa fisico y politico de la Argentina y de las Provincias,333,"Archivos vectoriales correspondientes a diferentes objetos geograficos tales como actividades humanas, centros poblados, coberturas del suelo, cuerpos de agua, cursos de agua, curvas de nivel, departamentos, tejidos urbanos, islas, limites politico-administrativos, provincias, puentes, puntos geograficos destacados, red vial, infraestructura rural, infraestructura de transporte, coberturas hojas escala",eventual,Eventual,2º semestre de 2016,45,Defensa,Defensa
Archivos transferencia de tiempo,334,Información para diseminar y comparar la escala de tiempo GPS y tiempo atómico.,eventual,Eventual,2º semestre de 2016,45,Defensa,Defensa
Red Argentina de Gravedad Absoluta,335,Gravedad de los puntos RAGA,eventual,Eventual,2º semestre de 2016,45,Defensa,Defensa
Red Gravimétrica de Primer Orden (BACARA),336,Valores de gravedad finales que surgen de un ajuste por minimos cuadrados,eventual,Eventual,1º semestre de 2017,45,Defensa,Defensa
Normas de uso de abreviaturas,337,Listado que normaliza las abreviaturas usadas por el IGN,eventual,Eventual,2º semestre de 2016,45,Defensa,Defensa
Prónostico del Tiempo,338,"Pronóstico de temperatura, viento y precipitación para varias localidades del país.",R/P1D,Diaria,1º semestre de 2017,45,Defensa,Defensa
Dato meteorológico de todas las estaciones de superficie del país (GTS),339,Sistema coordinado de telecomunicación global que permite conocer los datos de las estaciones meteorológicas de todo el país.,R/P1D,Diaria,1º semestre de 2017,45,Defensa,Defensa
Registro de Temperatura,340,Temperaturas máximas y mínimas diarias registradas durante el último año.,R/P1Y,Anual,1º semestre de 2017,45,Defensa,Defensa
Mapa de Estaciones,341,"Ubicación de las estaciones meteorológicas, su código OACI, latitud y longitud",eventual,Eventual,1º semestre de 2017,45,Defensa,Defensa
Datos de Radiación,342,Datos que se obtienen mediante la medición de la radiación solar y su interacción con la atmósfera,eventual,Eventual,2º semestre de 2016,45,Defensa,Defensa
Alertas,343,Advertencias sobre fenómenos meteorológicos significativos que pueden poner en riesgo la vida de la población.,eventual,Eventual,2º semestre de 2016,45,Defensa,Defensa
Estado del Tiempo,344,Último registro de las variable meterológicas medidas en la red del SMN,R/PT1S,Tiempo real,2º semestre de 2016,45,Defensa,Defensa
Imágenes Satelitales,345,Imagenes obtenidas a través de satelites geoestacionarios y satelites de órbita polar.,eventual,Eventual,2º semestre de 2016,45,Defensa,Defensa
Imágenes de Radar,346,imágenes provenientes de los radares situados en diferentes provincias.,R/PT1S,Tiempo real,2º semestre de 2016,45,Defensa,Defensa
Estadística Climática Básica,347,"Valores medios y/o extremos a nivel mensual y anual de algúnos parámetros (temperatura máxima, media y mínima, humedad, presión al nivel del mar, heliofanía, viento, precipitación, número de días con cielo cubierto, con cielo claro y con lluvia) calculados a partir de series históricas de los períodos 2001-2010.",R/P1Y,Anual,2º semestre de 2016,45,Defensa,Defensa
Vigilancia del clima,348,"Mapas y gráficos integrados en distintas escalas temporales de temperatura media, máxima y mínima y frecuencia de temperaturas extremas, precipitación días con precipitación, índices de sequías, heliofanía, y anomalías de dichos parámetros.",eventual,Eventual,2º semestre de 2016,45,Defensa,Defensa
SIPA,349,Información relativa a los sujetos pasivos y activos que integran el sistema integrado previsional argentino,R/P6M,Semestral,1º semestre de 2017,75,Trabajo,Trabajo
Asignacion universal por hijo,350,Datos relativos al alcance de la asignacion universal por hijo,R/P6M,Semestral,1º semestre de 2017,75,Trabajo,Trabajo
Asignacion universal por embarazo,351,Datos relativos al alcance de la asignacion universal por embarazo,R/P3M,Trimestral,1º semestre de 2017,75,Trabajo,Trabajo
