denominacion,descripcion,actualizacion,fecha,jurisdiccion,nombre_tarjeta_home
Estadísticas Viales,"Estadísticas Viales referentes accidentología, estudios de seguridad y georrefenciacion de los mismos",Trimestral,2º semestre de 2016,Ministerio de Transporte,Transporte
Mapa del Transporte Nacional,"Incluye red vial, red ferroviaria, rutas aereas",Eventual,2º semestre de 2016,Ministerio de Transporte,Transporte
Registro Nacional de Aeronaves (ANAC),Registro y afectacion de aeronaves,Eventual,2º semestre de 2016,Ministerio de Transporte,Transporte
Talleres Habilitados (ANAC),Listado de Talleres Aeronáuticos Habilitados,Eventual,2º semestre de 2016,Ministerio de Transporte,Transporte
Estadísticas de Transporte (CNRT),"Estadísticas del Transporte Automotor, ferroviario y denuncias. ",Trimestral,2º semestre de 2016,Ministerio de Transporte,Transporte
Habilitaciones (CNRT),"Conductores, vehículos y empresas habilitados ",Eventual,2º semestre de 2016,Ministerio de Transporte,Transporte
Biblioteca Vialidad,Catálogo y listados ,Mensual,2º semestre de 2016,Ministerio de Transporte,Transporte
Informe estadístico Puerto de Buenos Aires (AGP),Estadísticas de Operaciones en Puerto de Buenos Aires,Trimestral,2º semestre de 2016,Ministerio de Transporte,Transporte
"Estadística del Sistema Nacional de Aeropuertos: tráficos de pasajeros, cargas y aeronaves (ORSNA)",Estadísticas de Operaciones en los Aeropuertos de Argentina,Trimestral,2º semestre de 2016,Ministerio de Transporte,Transporte
Registro de Conductores Habilitados (CNRT),Conductores habilitados,Eventual,2º semestre de 2016,Ministerio de Transporte,Transporte
Registro de Empresas Habilitadas (CNRT),Empresas habilitadas,Eventual,2º semestre de 2016,Ministerio de Transporte,Transporte
Registro de Vehículos Habilitados (CNRT),Vehículos habilitados,Eventual,2º semestre de 2016,Ministerio de Transporte,Transporte
Trenes en Directo,Información en tiempo real correspondiente a los servicios de trenes en el área metropolitana.,Tiempo real,2º semestre de 2016,Ministerio de Transporte,Transporte
Recorridos del transporte automotor de corta distancia,"Datos correspondientes a las líneas, recorridos, paradas y horarios del servicio de transporte automotor de corta distancia bajo jurisdicción de la CNRT",Trimestral,2º semestre de 2016,Ministerio de Transporte,Transporte
Estadísticas Tributarias,Estadísticas mensuales y anuales de recaudación tributaria por tipo de impuesto,Eventual,2º semestre de 2016,Ministerio de Hacienda y Finanzas Públicas,Hacienda
Registro Especial Aduanero,"Registro de Importadores y Exportadores, Auxiliares del Comercio y del Servicio Aduanero, sus apoderados generales y dependientes y los otros sujetos comprendidos en el Título IV de la Sección I de la Ley N° 22.415 y sus modificaciones.",Eventual,2º semestre de 2016,Ministerio de Hacienda y Finanzas Públicas,Hacienda
Domicilio Especial Aduanero,Listado de domicilios especiales ubicados en el radio urbano de la aduana en la que sujetos obligados ejercen su actividad,Eventual,2º semestre de 2016,Ministerio de Hacienda y Finanzas Públicas,Hacienda
Registro de operaciones inmobiliarias y locaciones de inmuebles,Registro de personas o sujetos que realicen o intervengan en operaciones económicas vinculadas con bienes inmuebles RG N° 2820 (2010),Eventual,2º semestre de 2016,Ministerio de Hacienda y Finanzas Públicas,Hacienda
Comercializadores de Materiales a Reciclar,"Registro de recicladores, acopiadores, galponeros, generadores de ""scrap"", e intermediarios que participan en la cadena de comercialización de materiales a reciclar",Eventual,2º semestre de 2016,Ministerio de Hacienda y Finanzas Públicas,Hacienda
"Imprentas, autoimpresores e importadores",Registro de empresas hablitadas para la impresión de comprobantes fiscales.,Eventual,2º semestre de 2016,Ministerio de Hacienda y Finanzas Públicas,Hacienda
Operadores de Productos Gravados Exentos por Destino Industrial,Registro de transportistas y comercializadores de los productos gravados exentos por destino industrial,Eventual,2º semestre de 2016,Ministerio de Hacienda y Finanzas Públicas,Hacienda
Operadores de Compraventa de Granos y Legumbres Secas,Registro Fiscal de sujetos involucrados en la comercialización de granos y legumbres secas.,Eventual,2º semestre de 2016,Ministerio de Hacienda y Finanzas Públicas,Hacienda
Operadores de Comercialización de Granos,Registro de Operadores de Comercialización de Granos,Eventual,2º semestre de 2016,Ministerio de Hacienda y Finanzas Públicas,Hacienda
Registro Fiscal de Empresas Mineras,Listado de Empresas Mineras habilitadas a operar en el territorio de la República Argentina,Eventual,2º semestre de 2016,Ministerio de Hacienda y Finanzas Públicas,Hacienda
Registro Fiscal de Proveedores de Empresas Mineras,Listado de empresas proveedoras de bienes y servicios a Empresas Mineras habilitadas a operar en el territorio de la República Argentina,Eventual,2º semestre de 2016,Ministerio de Hacienda y Finanzas Públicas,Hacienda
Registro de Titulares de Permisos de Exploración y Cateo,Listado de empresas o personas habilitadas para realizar exploración y cateo en el territorio de la República Argentina,Eventual,2º semestre de 2016,Ministerio de Hacienda y Finanzas Públicas,Hacienda
Clasificador de Actividades Económicas (CLAE),"El Clasificador de Actividades Económicas (CLAE) ordena y agrupa los datos relativos a los responsables que se vinculan con la Administración Federal de Ingresos Públicos, según atributos análogos u homogéneos que tienen en cuenta la forma en que las actividades económicas se realizan y combinan.",Eventual,2º semestre de 2016,Ministerio de Hacienda y Finanzas Públicas,Hacienda
Estadíticas: principales variables,"Valores diarios y series históricas correspondientes a las principales variables, incluyendo Base Monetaria, Reservas del Banco Central, etc.",Diaria,2º semestre de 2016,Ministerio de Hacienda y Finanzas Públicas,Hacienda
Indicadores del BCRA,"Valores diarios y series históricas correspondientes al índice de Precio de las Materias Primas (IPMP), Tipo de Cambio Multilateral, y Programa NEDD",Eventual,2º semestre de 2016,Ministerio de Hacienda y Finanzas Públicas,Hacienda
Series Estadísticas,"Paquetes estandarizados correspondientes a variables monetarias, Sistema Nacional de Pagos, deuda externa privada, etc",Eventual,2º semestre de 2016,Ministerio de Hacienda y Finanzas Públicas,Hacienda
Relevamiento de Expectativas de Mercado (REM),"Listado de participantes, informe mensual, resultados históricos",Mensual,2º semestre de 2016,Ministerio de Hacienda y Finanzas Públicas,Hacienda
Regimen de Transparencia,"Información suministrada por las entidades financieras en virtud del Régimen Informativo establecido en las Comunicaciones ""A"" 4184, 4191 y 4195",Mensual,2º semestre de 2016,Ministerio de Hacienda y Finanzas Públicas,Hacienda
Entidades del Sistema Financiero,"Datos correspondientes al registro de entidades no financieras, Empresas no financieras emisoras de tarjetas de crédito y/o compra, Sociedades de Garantía Reciproca y Fondos de garantia de carácter público",Eventual,2º semestre de 2016,Ministerio de Hacienda y Finanzas Públicas,Hacienda
Registro de Auditores Externos,"Listado de los contadores públicos que se desempeñan como auditores externos, titulares o suplentes, de los estados contables de las entidades que estén sujetas a su control de la CNV.",Eventual,2º semestre de 2016,Ministerio de Hacienda y Finanzas Públicas,Hacienda
Programas para Certificar Idoneidad,Listado de Programas para certificar idoneidad aprobados por la CNV.,Eventual,2º semestre de 2016,Ministerio de Hacienda y Finanzas Públicas,Hacienda
Registro de Idoneidad,Registro de Idóneos habilitados para efectuar las actividades definidas en el artículo 3° del Capítulo II (Normas CNV N.T. 2013 y mod.),Eventual,2º semestre de 2016,Ministerio de Hacienda y Finanzas Públicas,Hacienda
"Mercados, Cámaras Compensadoras y Agentes","Registro de Mercados, Cámaras Compensadoras y Agentes Autorizados por la CNV (Ley 26.831)",Eventual,2º semestre de 2016,Ministerio de Hacienda y Finanzas Públicas,Hacienda
Comisiones Regimen de Transparencia,Información de diferentes mercados ingresada por las Entidades a la CNV,Eventual,2º semestre de 2016,Ministerio de Hacienda y Finanzas Públicas,Hacienda
Informe Diario de Mercados,Información sobre movimientos bursatiles,Eventual,2º semestre de 2016,Ministerio de Hacienda y Finanzas Públicas,Hacienda
Informe Económico Trimestral,Análisis de la coyuntura macroeconómica argentina e internacional.,Eventual,2º semestre de 2016,Ministerio de Hacienda y Finanzas Públicas,Hacienda
Información económica al día - Nivel de actividad,"Medición de volúmenes y ritmo de crecimiento de la actividad generadora de bienes y servicios. Indicadores de oferta y demanda globales, PBI e índices de actividad.",Eventual,2º semestre de 2016,Ministerio de Hacienda y Finanzas Públicas,Hacienda
Información económica al día - Empleo e ingresos,"Información sobre variables ocupacionales: estadísticas, evolución, tasas, estimaciones, ingresos, salarios, costos y aspectos previsionales.",Eventual,2º semestre de 2016,Ministerio de Hacienda y Finanzas Públicas,Hacienda
Información económica al día - Finanzas Públicas,Información sobre ingresos y gastos en el Sector Público Nacional Financiero y no Financiero,Eventual,2º semestre de 2016,Ministerio de Hacienda y Finanzas Públicas,Hacienda
Información económica al día - Dinero y Bancos,"Información sobre el sector financiero (tasas de interés, agregados monetarios, préstamos, reservas y pasivos financieros, exigencias de encaje o liquidez, CER)",Eventual,2º semestre de 2016,Ministerio de Hacienda y Finanzas Públicas,Hacienda
Información económica al día - Sector Externo,Información estadística sobre la balanza de pagos y balanza comercial.,Eventual,2º semestre de 2016,Ministerio de Hacienda y Finanzas Públicas,Hacienda
Información económica al día - Precios,Indices de Precios locales e internacionales,Eventual,2º semestre de 2016,Ministerio de Hacienda y Finanzas Públicas,Hacienda
Información económica al día - Precios,Indices de Precios locales e internacionales,Eventual,2º semestre de 2016,Ministerio de Hacienda y Finanzas Públicas,Hacienda
Informes productivos sectoriales y regionales,"Descripción analítica y estructural de diversas cadenas de valor del aparato productivo argentino. Se consideran temáticas como: la configuración de relaciones económicas; la situación productiva y económica de la cadena; el mercado global y tendencias; su proceso productivo y su evolución; la localización territorial; la incidencia de las políticas públicas, entre otros aspectos de relevancia.",Eventual,2º semestre de 2016,Ministerio de Hacienda y Finanzas Públicas,Hacienda
Anuncios de Inversión del Sector Privado (2016 - 2019),"Análisis de los anuncios de inversión privada por región, clasificación VAB, por cadena de valor, por empresas, por origen de la inversión, entre otros.",Eventual,2º semestre de 2016,Ministerio de Hacienda y Finanzas Públicas,Hacienda
Estadísticas de deuda pública,"Deuda del Sector Público Nacional clasificada por instrumentos, series y perfiles de vencimientos",Eventual,2º semestre de 2016,Ministerio de Hacienda y Finanzas Públicas,Hacienda
Base de Datos de Deuda Pública I trimestre 2016,Base de Datos de Deuda Pública I trimestre 2016,Eventual,2º semestre de 2016,Ministerio de Hacienda y Finanzas Públicas,Hacienda
Informe de Deuda Pública,Informe de Deuda Pública,Eventual,2º semestre de 2016,Ministerio de Hacienda y Finanzas Públicas,Hacienda
"Cupones, precios técnicos y coeficientes de PG","Información sobre cupones, coeficientes y precios técnicos utilizados por los organismos deudores para calcular deudas consolidadas",Eventual,2º semestre de 2016,Ministerio de Hacienda y Finanzas Públicas,Hacienda
Valores negociables vinculados al PBI,Datos sobre valores negociables vinculados al PBI,Eventual,2º semestre de 2016,Ministerio de Hacienda y Finanzas Públicas,Hacienda
Deuda Pública,"Colocaciones financieras, estructura financiera de títulos públicos, resultados de recompra de títulos públicos y reestructuraciones.",Eventual,2º semestre de 2016,Ministerio de Hacienda y Finanzas Públicas,Hacienda
"Recaudación de impuestos nacionales, mensuales y anuales y comparaciones.","Informes sobre recaudación, gastos tributarios, presión tributaria y normativa",Eventual,2º semestre de 2016,Ministerio de Hacienda y Finanzas Públicas,Hacienda
Resultado Fiscal,Cuenta Ahorro – Inversión – Financiamiento del Sector Público Nacional – Base Caja – Mensual,Eventual,2º semestre de 2016,Ministerio de Hacienda y Finanzas Públicas,Hacienda
Cuenta de Inversión,"Expone los estados que permiten conocer la gestión presupuestaria, de caja y patrimonial de las entidades públicas",Eventual,2º semestre de 2016,Ministerio de Hacienda y Finanzas Públicas,Hacienda
Boletín Fiscal,Información económico-financiera de carácter periódico y sistemático,Eventual,2º semestre de 2016,Ministerio de Hacienda y Finanzas Públicas,Hacienda
Leyes de Presupuesto,"Ley de presupuesto vigente para el ejercicio, nosmas de promulgación y dstribución",Eventual,2º semestre de 2016,Ministerio de Hacienda y Finanzas Públicas,Hacienda
Programa de Fortalecimiento Institucional Provincial y de Gestión Financiera (PROFIP),Fortalecimiento de las instituciones públicas para la toma de decisiones en base a información sobre desempeño y resultados.,Eventual,2º semestre de 2016,Ministerio de Hacienda y Finanzas Públicas,Hacienda
Política Salarial,Política Salarial,Eventual,2º semestre de 2016,Ministerio de Hacienda y Finanzas Públicas,Hacienda
Informe Trimestral de Ocupación y Salarios del Sector Público,Informe Trimestral de Ocupación y Salarios del Sector Público,Eventual,2º semestre de 2016,Ministerio de Hacienda y Finanzas Públicas,Hacienda
Presupuestos,"Mensajes, proyectos de Ley, comunicados, presupuesto plurianual e informes de avance",Eventual,2º semestre de 2016,Ministerio de Hacienda y Finanzas Públicas,Hacienda
Empresas públicas y fondos fiduciarios,Instructivos para la formulación del presupuesto y confección de la cuenta ahorro inversión financiamiento de los entes.,Eventual,2º semestre de 2016,Ministerio de Hacienda y Finanzas Públicas,Hacienda
Ejecución presupuestaria,"Cuenta Ahorro - Inversión - Financiamiento del Sector Público Nacional y datos de ejecución presupuestaria del Sector Público Nacional, de la Administración Nacional.",Eventual,2º semestre de 2016,Ministerio de Hacienda y Finanzas Públicas,Hacienda
Evaluación presupuestaria,"Seguimiento Físico - Financiero, indicadores e informe resumen",Eventual,2º semestre de 2016,Ministerio de Hacienda y Finanzas Públicas,Hacienda
Información fiscal provincial y municipal,"Indicadores fiscales y financieros, recursos tributarios e información vinculada al Régimen de Responsabilidad Fiscal",Eventual,2º semestre de 2016,Ministerio de Hacienda y Finanzas Públicas,Hacienda
Información fiscal provincial y municipal,"Características de los regímenes municipales, principales normas, potestades tributarias e indicadores presupuestarios.",Eventual,2º semestre de 2016,Ministerio de Hacienda y Finanzas Públicas,Hacienda
Fondos Federales y Responsabilidad Fiscal,Pendiente,Eventual,2º semestre de 2016,Ministerio de Hacienda y Finanzas Públicas,Hacienda
